{
  "eir_schema_version": "0.2.0",
  "document_state": "complete",
  "document_origin": "authored",
  "project": {"project_id": "prj_demo"},
  "revision": {"revision_id": "rev_bar_001", "project_id": "prj_demo", "parent_revision_ids": [], "manifest_sha256": null},
  "geometry": [{"geometry_id": "geom_bar_region", "artifact_id": "step_source", "length_unit": "mm", "frame_id": "world"}],
  "materials": [{"material_id": "steel", "model": "linear_elastic_isotropic", "properties": {"young_modulus": {"value": 210000, "unit": "N/mm2"}, "poisson_ratio": {"value": 0.3, "unit": "1"}}}],
  "frames": [{"frame_id": "world", "parent_frame_id": null, "translation": {"value": [0, 0, 0], "unit": "mm"}, "rotation_xyzw": [0, 0, 0, 1]}],
  "simulation_cases": [{
    "case_id": "axial_bar",
    "revision_id": "rev_bar_001",
    "domain": "structural",
    "analysis": "static_linear",
    "frame_id": "world",
    "geometry_refs": ["geom_bar_region"],
    "material_refs": ["steel"],
    "material_assignments": [{"geometry_id": "geom_bar_region", "material_id": "steel"}],
    "group_manifest_ref": "groups_axial_bar",
    "loads": [],
    "constraints": [{"group": "X_FIXED", "kind": "displacement", "components": {"x": {"value": 0, "unit": "mm"}}, "frame_id": "world"}],
    "solver": {"adapter_id": "calculix.batch", "proposed_target_version": "2.23"}
  }]
}
